Title, Company, Location, Link
Senior Python Data Business Intelligence Analytics Engineer in San Jose CA, OSI Engineering, San Jose CA, https://job-openings.monster.com/senior-python-data-business-intelligence-analytics-engineer-in-san-jose-ca-san-jose-ca-us-osi-engineering/215871129
Bioinformatics Software Engineer, CyberCoders, Redwood City CA, https://job-openings.monster.com/bioinformatics-software-engineer-redwood-city-ca-us-cybercoders/217373216
Associate Scientist III, Park Computer Systems Inc., sunnyvale CA, https://job-openings.monster.com/associate-scientist-iii-sunnyvale-ca-us-park-computer-systems-inc/217280028
Biometric Fingerprinting Technician  ON CALL-US-CA-Santa Clara, PAE, Santa Clara CA, https://job-openings.monster.com/biometric-fingerprinting-technician-on-call-us-ca-santa-clara-santa-clara-ca-us-pae/d5dd513f-a8c9-4b0d-a679-9cba7d715aae
Chemical Process Tech, kyyba, Fremont CA, https://job-openings.monster.com/chemical-process-tech-fremont-ca-us-kyyba/216943800
Data Scientist, Skoruz Inc, Sunnyvale CA, https://job-openings.monster.com/data-scientist-sunnyvale-ca-us-skoruz-inc/217228584
SAS Data Engineer, Dew Software, Mountain View CA, https://job-openings.monster.com/sas-data-engineer-mountain-view-ca-us-dew-software/217133060
Lab Technician, ASICSoft Inc., San Jose CA, https://job-openings.monster.com/lab-technician-san-jose-ca-us-asicsoft-inc/217234658
Associate Research Scientist, AIC, Redwood City CA, https://job-openings.monster.com/associate-research-scientist-redwood-city-ca-us-aic/217168237
Java Full Stack Developer, 3k Technologies LLC, Santa Clara CA, https://job-openings.monster.com/java-full-stack-developer-santa-clara-ca-us-3k-technologies-llc/217445176
Computer Vision Researcher/Engineer, OSI Engineering, Sunrise FL, https://job-openings.monster.com/computer-vision-researcher-engineer-sunrise-fl-us-osi-engineering/207779101
Software Engineer, Juniper Networks, Sunnyvale CA, https://job-openings.monster.com/software-engineer-sunnyvale-ca-us-juniper-networks/217372020
Principal Software Engineer, Spectrocloud Inc., Santa Clara CA, https://job-openings.monster.com/principal-software-engineer-santa-clara-ca-us-spectrocloud-inc/217317518
Python developer, Northbound LLC, Campbell CA, https://job-openings.monster.com/python-developer-campbell-ca-us-northbound-llc/211494488
Principal Software Engineer, Dasera Inc, Sunnyvale CA, https://job-openings.monster.com/principal-software-engineer-sunnyvale-ca-us-dasera-inc/217257964
Software Engineer, Global Edge Software Inc, Sunnyvale CA, https://job-openings.monster.com/software-engineer-sunnyvale-ca-us-global-edge-software-inc/216206364
Application Developer, Flexton Inc., San Jose CA, https://job-openings.monster.com/application-developer-san-jose-ca-us-flexton-inc/217141807
Senior Software Engineer, eFolder Inc, San Jose CA, https://job-openings.monster.com/senior-software-engineer-san-jose-ca-us-efolder-inc/217020583
Jr Python Developer, Advantage Resourcing, Palo Alto CA, https://job-openings.monster.com/jr-python-developer-palo-alto-ca-us-advantage-resourcing/217409934
Staff Software Engineer, MobileIron Inc., Mountain View CA, https://job-openings.monster.com/staff-software-engineer-mountain-view-ca-us-mobileiron-inc/217372016
Software Engineer, Company Confidential, Mountain View CA, https://job-openings.monster.com/software-engineer-mountain-view-ca-us/217318240
Java Developer with AWS, Peach IT Professionals Inc., Mountain View CA, https://job-openings.monster.com/java-developer-with-aws-mountain-view-ca-us-peach-it-professionals-inc/217313627
Robotics S/W Engr., JD.com American Technologies Corp., Mt View CA, https://job-openings.monster.com/robotics-s-w-engr-mt-view-ca-us-jd-com-american-technologies-corp/217257959
SOFTWARE ENGINEER, cPacket Networks Inc., Alviso CA, https://job-openings.monster.com/software-engineer-alviso-ca-us-cpacket-networks-inc/217247580
java developer with AWS, ASK Innovations Inc, mountain view CA, https://job-openings.monster.com/java-developer-with-aws-mountain-view-ca-us-ask-innovations-inc/217230782
Software Engineer, Wilco Source LLC, Newark CA, https://job-openings.monster.com/software-engineer-newark-ca-us-wilco-source-llc/217180679
