Title,Company,Location,Link,JobSource
Society Of Women Engineers Virtual Career Fair - Engineering Opportunities, Apple, Santa Clara CA, https://www.indeed.com/rc/clk?jk=78d8659a2a50b18b&fccid=c1099851e9794854&vjs=3, Indeed
Software Engineer Iii, Wal-Mart, Sunnyvale CA, https://job-openings.monster.com/software-engineer-iii-sunnyvale-ca-us-wal-mart/217502392, Monster
Part-Time Computer Science Teacher, Notre Dame High School San Jose, San Jose CA 95112 (Downtown area), https://www.indeed.com/pagead/clk?mo=r&ad=-6NYlbfkN0BAgd1X88nLcaTlXQZWdWIC4h2Ef4SrdLHR-WcLcUE-oiV8VmGC3PY1W8cCe5Kfg4SOIEtGgvZDiw_7w2nrCMOXh8B4PyKHYC8NvQ5XVV5Ko7ZJEMroxUR_893i-AuHnEhZcStc7HjE-Pat6kUlyVVvoQ5qM0mVwE60JtUMEpQZizMRJjWPm3RWopsbXj_5Sf4KxPQMH3TRg4FpLpYY9gMuu1091_mBirdfgACQjuBj0AnvUIdrMVWBiuahETov8l6ddU6rfRTNSnMf1sY9TiS9YZZMKFhaL10GWg57QtgAt8FC-84SqFyUhiXBJqkvrWDbBuBXc6UXiqhNU6BIIHewAiZZPFLRV8NECHmEfNo4vcy5C1jxaLqcGgII1h6mMbji5JHHrUnMvvI2gfVytKl6GgWzH2JrxAuzCyvenj0LknhwTrA6aYFUjdaFQlZC96_dHfqPdNdrkRWMtSdOaRtk6Ij59dtevJo=&p=16&fvj=1&vjs=3, Indeed
Software Engineer, Advantage Resourcing, Milpitas CA, https://job-openings.monster.com/software-engineer-milpitas-ca-us-advantage-resourcing/217547057, Monster
Software Application Engineer, Teradyne Inc., San Jose CA, https://job-openings.monster.com/software-application-engineer-san-jose-ca-us-teradyne-inc/217502381, Monster
Technical Support Manager, Splashtop Inc., San Jose CA 95129 (West San Jose area), https://www.indeed.com/pagead/clk?mo=r&ad=-6NYlbfkN0BHz9YEKfC5jjSGtVQVO4BYSPC_EXw3vBERcFdVbIgzwROCgGeIBSAU2RF3YwDGS8jj_-HN7jBe0w2b_eAyBALNTCBRWU-mgC2EQ8Dd3HlmfCuPXoD_N3PP8f6HrTGhZ1SAd33oR7d71VX0tws6Ffe5KI3RLHZUR-rfnx7gOhT6o4UQCkzyFZ1xJIzDEOyFXtUI--jIVfa7e1h6-sW9X4nXksXSopSN0yblG8Z0t_9hvRpcdlHqkfVfAWs7GMhdED62RmAUJ_P40h01-GNXPQGjssqUFfZF4vpVJBCPK-h-hLAvVgdfsAty1gZlpoT9tsUdnufGcfANxnXg9p8zsxbDxzKUysBp0aL5ucIvkeJFKCHGGI2ovpRrORcBCS8pTB3AbyiGBJlAcCIwkO1l19CUO0Ot-Kgo0kOAIvs9cw5y9kclPLZn43xsMVAH75bt4jXVnU8p8uuwAtJbzOUvuJY1-Z484tLr3z4=&p=17&fvj=1&vjs=3, Indeed
Senior Manager Software Engineering (Build/Release), E-TRADE, Menlo Park CA, https://job-openings.monster.com/senior-manager-software-engineering-build-release-menlo-park-ca-us-e-trade/217192820, Monster
Software Engineer, Tinoq Inc., San Jose CA, https://job-openings.monster.com/software-engineer-san-jose-ca-us-tinoq-inc/217583192, Monster
Software Engineering Internship, Apple, Santa Clara CA, https://www.indeed.com/rc/clk?jk=b462839caec76930&fccid=c1099851e9794854&vjs=3, Indeed
Lab Technician, ASICSoft Inc., San Jose CA, https://job-openings.monster.com/lab-technician-san-jose-ca-us-asicsoft-inc/217234658, Monster
Sas Data Engineer, Dew Software, Mountain View CA, https://job-openings.monster.com/sas-data-engineer-mountain-view-ca-us-dew-software/217133060, Monster
Salesforce Government Cloud Implementations Consultant :: Sunnyvale Ca :: Phone + Skype, Cybertec Inc, Sunnyvale CA, https://job-openings.monster.com/salesforce-government-cloud-implementations-consultant-sunnyvale-ca-phone-skype-sunnyvale-ca-us-cybertec-inc/217555915, Monster
Application Engineer, DaVinchi Inc, San Jose CA, https://job-openings.monster.com/application-engineer-san-jose-ca-us-davinchi-inc/217502383, Monster
Embedded Software Intern, Packet Path, Santa Clara CA, https://www.indeed.com/company/Packet-Path/jobs/Embedded-Software-Intern-eca0b78c7c2548eb?fccid=a5a37ea7feb67a7b&vjs=3, Indeed
Compiler Qa Undergraduate Intern, Intel, Santa Clara CA, https://www.indeed.com/rc/clk?jk=134d0f22e2d2bde6&fccid=f1374be6a45f4b8a&vjs=3, Indeed
Computer Science Programs (Entry Level And Above), Livermore Navy College and Career Center, Santa Clara CA, https://www.indeed.com/company/Navy-Talent-Aquisition-Group/jobs/Computer-Science-Program-9ecacae4136a619f?fccid=00176882e699ffb9&vjs=3, Indeed
Bioinformatics Software Engineer, CyberCoders, Redwood City CA, https://job-openings.monster.com/bioinformatics-software-engineer-redwood-city-ca-us-cybercoders/217480087, Monster
Software Engineer, LTA Research & Exploration, Mountain View CA, https://www.indeed.com/pagead/clk?mo=r&ad=-6NYlbfkN0D8ODmvOfgFoUR3noi9T2xJml3k34GIGgY8Dss4CsPUI0EEx__vBqZwCigiHOqHXoplxH8vUpZIajgkq090sd_EymElbEtolgtEOioW8tsZjef-_Ln4lJ9t-z_b4YBUqC7eF6ViO48vdYESSoBz0ovaLFqkhPv0rF-_-PFUPGC1f-yIcOoWs04vZ4fLB_ssHtH9ND8GYjlemyS7LutJnokZbVulxUXC6Ekkw3mB9NnqX-bvA6ISwruh2Ptx70WLyNQ7klKTiJiJHoSxpjFlutvOu2LXIWy4mz8wHsO9Oef8ncPx4TYqZPBjLui1T_OHfwx4aOpyN-9_ceRf9WsXXawwcV0WqK3zE8tRLtXfxeKRi28VNNxgQiga_zJ_c0J8kktlerTbiHMNmeC8eKGwBE5ws1rNEvGJrz6QXvKu6Jl6eJtJgJDtNRmH_Q7q71bQ93jpn5tkjRxb7j-nIXNh-ROm&p=0&fvj=1&vjs=3, Indeed
Data Scientist Medical Diagnostics, Specific Diagnostics, Mountain View CA 94043, https://www.indeed.com/pagead/clk?mo=r&ad=-6NYlbfkN0ASXGwdLWjBNYivRaShgyLT0X0BdS_EVSQWni2gtHz1pazciS9pJg_LVuqiSysEs-TR87Z6YRyIB6Z6ONWtxHG1G-OL9Fo4q1xFwAb2JfyhSmv5dLGAwhPfY3DaGtrFB_kwDVTIlQA9-nWZ16r6EzFdG5JAX_9z0fuE-qCtQ909njxbW15sZ0Kqqk_wUImabLokVd95_25qzJrOWizYCOMLyVrtxmeyx-VbtAdIAyXnMMfDT19OBgD6Kx3VAB9MOo4jgvm4cA1QZ34miLcMUr0XQbClejO7-I6IGMeqpK-VuHrXFR3bqAEbP2xIJD2fX_CBJtKjSU2y8OYieMBfpdNa0alSsA3nMNuyrILmSGZh4yyvJr1ycda8y8nHaEGbjgwA9Y_KyMKWAVjjIb4Obx-JM4ZEspYS-tn4W2H9rO4fuCtuu8b5zlnls07GDsMR6NmqzgtifmsXuBI1WHzgpeLYe3mb3kN8LsIKbUQTaQsnrA==&p=4&fvj=1&vjs=3, Indeed
Data Scientist, Skoruz Inc, Sunnyvale CA, https://job-openings.monster.com/data-scientist-sunnyvale-ca-us-skoruz-inc/217228584, Monster
Software Engineer, Juniper Networks, Sunnyvale CA, https://job-openings.monster.com/software-engineer-sunnyvale-ca-us-juniper-networks/217502380, Monster
Associate Research Scientist, AIC, Redwood City CA, https://job-openings.monster.com/associate-research-scientist-redwood-city-ca-us-aic/217168237, Monster
Machine Learning And Artificial Intelligence Researcher, Apollo AI Inc., Santa Clara CA, https://www.indeed.com/company/Apollo-AI-Inc./jobs/Machine-Learning-Artificial-Intelligence-Researcher-b6ebbc4862cb99a4?fccid=b01fa1da7986c496&vjs=3, Indeed
Solutions Engineer - Enterprise Saas Software, CENTRL Inc, Mountain View CA 94041, https://www.indeed.com/pagead/clk?mo=r&ad=-6NYlbfkN0Cx6otC4ZvUQFsja-gFiq426hzVntMEekZfVrBZqW9meRUHJazFNClTagUcUVGfXRJH36fIBApi3AQE8Exb1KrabgKcoJZ-bfuh04viWq6KhV7FVIf_MAiQ0RN9dDl2bvSaRUk0pktWAEZ-nena4mB5ag5rbu6o-EAgsIu8J6Oa3Z9lHMoz7Nyy9McfwuiLOG2zwZOs2bkvJ9h8hOk-NVsCliV0qZAN9AN2Xr6CNQDTSOQxOKXaMdjH72dTeubKm_bTO7WVPpcY186ESEbXfsc5Wt7IXVjANlMXZB91rPDq3lpzz1kNN6Cw5iaXl6nDLcD3GJzc5ZEPM_vtpWcIJQ9X6JDqYXho3WAbp3y32_bmO0HBO8LQcvjKuZqkI7aE9MaK1IVL3OCX1UgUx2ViQd1hrK9x9KhFT6P7_AUd2qoobFiT12vcqiQOBnDUkhl_r7VSM1O9MwdrOp7SmUZ8w3ztchixFTiuDrEGd6DFLKichvrWaOioU68j&p=2&fvj=1&vjs=3, Indeed
Sales Engineer - Enterprise Saas Startup, CENTRL Inc, Mountain View CA 94041, https://www.indeed.com/pagead/clk?mo=r&ad=-6NYlbfkN0Cx6otC4ZvUQFsja-gFiq426hzVntMEekZfVrBZqW9meRUHJazFNClTREI0eCTcXM2IB2iqKgOdIYYBYEv1deU-cI0-7cnZqFYoalNRvvUc94mt97a3nL4tqJykbpSS4uMRTkxDB0xXPwrdzzuMxeOa86j3S5coxJzqsX_ODgf1MrDQmlVD-rekk6UmpqcYBJTpUhjbTCjchAbDmK85jxPOwHauIKR2zg6x98hq0zO-Py7JXadCwzByy89UMZ0vKO5boFLgkHZctv-HJGMC2LxYIM0MVTBM0nMgHmT6xRWQf52YeSTCjZMHt2XYqQgSF5FMQXxqAAfImY7D0kbR-Jr07PLYDTaKLG6ORxAukDMJobUCftdc9TVaYx4YnZ1drR9wGAHc7KnRlsDfszJtEgffbwjsn4eL2NwZeIVWntbRTuH3ML5gjNMtKc5I7du6mQ2Gc8ho3KDn9B2w62iZt-6UuLPchv8MSKQ=&p=1&fvj=1&vjs=3, Indeed
Computer Vision Researcher/Engineer, OSI Engineering, Sunrise FL, https://job-openings.monster.com/computer-vision-researcher-engineer-sunrise-fl-us-osi-engineering/207779101, Monster
Software Qa Engineer, Apple, Santa Clara CA, https://www.indeed.com/rc/clk?jk=9351f97815b5753d&fccid=c1099851e9794854&vjs=3, Indeed
Gis Security Engineer, Apex Systems, San Jose CA, https://job-openings.monster.com/gis-security-engineer-san-jose-ca-us-apex-systems/217532958, Monster
Java Full Stack Developer, 3k Technologies LLC, Santa Clara CA, https://job-openings.monster.com/java-full-stack-developer-santa-clara-ca-us-3k-technologies-llc/217445176, Monster
Siri - Software Engineer (Siri Rotational Program), Apple, Santa Clara CA, https://www.indeed.com/rc/clk?jk=8e2538b3667765d5&fccid=c1099851e9794854&vjs=3, Indeed
Java Developer With Aws, ASK Innovations Inc, mountain view CA, https://job-openings.monster.com/java-developer-with-aws-mountain-view-ca-us-ask-innovations-inc/217230782, Monster
Computer Vision Engineer, Mobile Programming, Santa Clara CA, https://job-openings.monster.com/computer-vision-engineer-santa-clara-ca-us-mobile-programming/217583283, Monster
Lte Software Engineer, Global Edge Software Inc, Sunnyvale CA, https://job-openings.monster.com/lte-software-engineer-sunnyvale-ca-us-global-edge-software-inc/217002733, Monster
Software Development And Test Engineer, Specific Diagnostics, Mountain View CA 94043, https://www.indeed.com/cmp/Specific-Diagnostics, Indeed
Statistical Programmer/Biostatistician(Remote), TechData, Sunnyvale CA, https://job-openings.monster.com/statistical-programmer-biostatistician-remote-sunnyvale-ca-us-techdata/217505555, Monster
Software Engineer, Electronic Arts Inc., Redwood City CA, https://job-openings.monster.com/software-engineer-redwood-city-ca-us-electronic-arts-inc/217282040, Monster
Senior Python Data Business Intelligence Analytics Engineer In San Jose Ca, OSI Engineering, San Jose CA, https://job-openings.monster.com/senior-python-data-business-intelligence-analytics-engineer-in-san-jose-ca-san-jose-ca-us-osi-engineering/215871129, Monster
Azure Cloud Engineer/Site Reliability Engineer (Remote), GDKN Corporation, Campbell CA, https://job-openings.monster.com/azure-cloud-engineer-site-reliability-engineer-remote-campbell-ca-us-gdkn-corporation/217491822, Monster
Software Engineering Intern, Cepheid, Santa Clara CA, https://www.indeed.com/rc/clk?jk=5d32dbe2a4343f11&fccid=2dc2f35c3405a529&vjs=3, Indeed
Associate Scientist Iii, Park Computer Systems Inc., sunnyvale CA, https://job-openings.monster.com/associate-scientist-iii-sunnyvale-ca-us-park-computer-systems-inc/217280028, Monster
Computer Science Teacher, AlphaStar Academy, Santa Clara CA, https://www.indeed.com/pagead/clk?mo=r&ad=-6NYlbfkN0AiKlwPi6OrNx76J4XXrGt7ndI2VKgGl5JTjXHneVPO7PUfEMWVE5Lu6bG0BZ8cxyV2WruC5hcUWno-z9ZL2J12IXq8IHeEz1MQJxjZcmHQRSHtlVtfdPhaPd4U25IZg-rl9fVus7khCSni-MnKIQiXp3FEiYhHbWVljo-1dKKlUTmM1XEXrsVVvwIEVFPv9GHLqSA1MZxQJVmzYWOoQWU8xlOGIu3xx1XFmOYdgxCaEBLXtrNNJhG6NCwox1TNQpstMVZeXgOZl74aR8CCnXsIpnG4lhlEBt4kTwCG6VlMjXJFlLZPB4f-jEtsO1McOJyhznWPKGXn6UzLBAHwYU956Hy2XaoK4dL6cFiE0MWG2Gco6zXYTEDbJiBxy2_DqmxANoMHO6fHANA6ACso_e9UxGllWLhUvt3PUz_XaNQ_bINTApaoTb5XZ-e7MXIbiO2KuKx7qx_JqLWTxQBj7uA-&p=5&fvj=1&vjs=3, Indeed
S/W Developer, Encore Software Services Inc, San Jose CA, https://job-openings.monster.com/s-w-developer-san-jose-ca-us-encore-software-services-inc/217502376, Monster
Software Engineer, Wilco Source LLC, Newark CA, https://job-openings.monster.com/software-engineer-newark-ca-us-wilco-source-llc/217180679, Monster
